{
  "schema_version": "2.0.0",
  "plan_id": "sim02c-m-b-source-acquisition-plan-v2",
  "regulation_id": "M-B",
  "target_pool_path": "data/fixtures/regulations/m-b-eligible-pokemon.json",
  "target_source_manifests": [
    {
      "manifest_id": "pokemon-home-regulation-m-b-current",
      "relative_path": "data/manifests/pokemon-home-regulation-m-b-current.json",
      "sha256": "f2ad9db826533fec03ce18bedc180899a6edcb36ae943c6cb22c1ab96e66f292",
      "required_authority": "official"
    }
  ],
  "expected_target_count": 235,
  "policy_registry_id": "sim02c-source-policy-register-v1",
  "routes": [
    {
      "route_id": "legacy-damage-implementation",
      "root_kind": "legacy",
      "source_kind": "local_implementation",
      "semantic_authority": "local_implementation",
      "source_ids": [
        "legacy_damage_calculator",
        "manual_damage_rules"
      ],
      "locators": [
        "legacy://src/champions/damage/calculator.py"
      ],
      "policy_id": "policy.legacy-damage.restricted-local",
      "candidate_roles": [
        "damage_model_candidate",
        "mechanics_candidate"
      ],
      "evidence_files": [
        {
          "artifact_id": "damage-calculator",
          "role": "implementation",
          "relative_path": "src/champions/damage/calculator.py",
          "required": true,
          "expected_source_id": "legacy_damage_calculator"
        },
        {
          "artifact_id": "damage-rules-builder",
          "role": "builder",
          "relative_path": "scripts/build_damage_rules.py",
          "required": true,
          "expected_source_id": null
        },
        {
          "artifact_id": "damage-rules-review",
          "role": "review_record",
          "relative_path": "docs/damage-rules-review.md",
          "required": true,
          "expected_source_id": null
        },
        {
          "artifact_id": "damage-rules-validator",
          "role": "validator",
          "relative_path": "scripts/validate_damage_rules.py",
          "required": true,
          "expected_source_id": null
        }
      ],
      "raw_inventories": [],
      "derived_artifacts": [
        {
          "artifact_id": "damage-rules",
          "relative_path": "data/processed/damage_rules.json",
          "record_pointer": "/rules",
          "expected_min_records": 34,
          "expected_source": "manual_damage_rules",
          "lineage_gap_hint": {
            "reason_codes": [
              "runtime_dependency_unpinned",
              "unregistered_input"
            ],
            "parent_refs": [],
            "unregistered_paths": [
              "docs/damage-rules.draft.json",
              "src/champions/damage/rule_loader.py"
            ],
            "runtime_dependencies": [
              "wall_clock_date"
            ]
          }
        }
      ]
    },
    {
      "route_id": "official-home-regulation",
      "root_kind": "legacy",
      "source_kind": "official_web_notice",
      "semantic_authority": "champions_official",
      "source_ids": [
        "pokemon_home_regulation_notice"
      ],
      "locators": [
        "https://news.pokemon-home.com/ja/page/751.html"
      ],
      "policy_id": "policy.official-pokemon.restricted-local",
      "candidate_roles": [
        "regulation_candidate"
      ],
      "evidence_files": [
        {
          "artifact_id": "official-home-config",
          "role": "source_config",
          "relative_path": "tools/data_fetcher/sources/pokemon_home_regulation_notice.json",
          "required": true,
          "expected_source_id": "pokemon_home_regulation_notice"
        },
        {
          "artifact_id": "official-home-manifest",
          "role": "raw_manifest",
          "relative_path": "data/raw/pokemon_home_regulation_notice/manifest.json",
          "required": true,
          "expected_source_id": "pokemon_home_regulation_notice"
        },
        {
          "artifact_id": "official-home-normalizer",
          "role": "normalizer",
          "relative_path": "scripts/normalize_pokemon_home_regulation_notice.py",
          "required": true,
          "expected_source_id": null
        },
        {
          "artifact_id": "official-home-parser",
          "role": "parser",
          "relative_path": "tools/data_fetcher/parsers/pokemon_home_regulation_notice.py",
          "required": true,
          "expected_source_id": null
        }
      ],
      "raw_inventories": [
        {
          "inventory_id": "official-home-raw",
          "relative_path": "data/raw/pokemon_home_regulation_notice",
          "suffixes": [
            ".html",
            ".json"
          ],
          "expected_min_files": 1
        }
      ],
      "derived_artifacts": [
        {
          "artifact_id": "official-home-regulation",
          "relative_path": "data/processed/regulation.json",
          "record_pointer": "",
          "expected_min_records": 1,
          "expected_source": "pokemon_home_regulation_notice"
        }
      ]
    },
    {
      "route_id": "pokedb-champions",
      "root_kind": "legacy",
      "source_kind": "third_party_battle_usage",
      "semantic_authority": "third_party_reference",
      "source_ids": [
        "article_insights",
        "pokedb_champions_article_bodies",
        "pokedb_champions_article_search",
        "pokedb_champions_garchomp_usage_detail",
        "pokedb_champions_pokemon_usage",
        "pokedb_champions_pokemon_usage_details",
        "pokedb_champions_top_articles"
      ],
      "locators": [
        "https://champs.pokedb.tokyo/"
      ],
      "policy_id": "policy.pokedb.restricted-local",
      "candidate_roles": [
        "article_insight_candidate",
        "environment_candidate",
        "team_candidate",
        "usage_candidate"
      ],
      "evidence_files": [
        {
          "artifact_id": "pokedb-article-bodies-fetcher",
          "role": "fetcher",
          "relative_path": "scripts/fetch_pokedb_article_bodies.py",
          "required": true,
          "expected_source_id": null
        },
        {
          "artifact_id": "pokedb-article-bodies-manifest",
          "role": "raw_manifest",
          "relative_path": "data/raw/pokedb_champions_article_bodies/manifest.json",
          "required": true,
          "expected_source_id": "pokedb_champions_article_bodies"
        },
        {
          "artifact_id": "pokedb-article-insights-normalizer",
          "role": "normalizer",
          "relative_path": "scripts/normalize_article_insights.py",
          "required": true,
          "expected_source_id": null
        },
        {
          "artifact_id": "pokedb-article-parser",
          "role": "parser",
          "relative_path": "tools/data_fetcher/parsers/pokedb_article_search.py",
          "required": true,
          "expected_source_id": null
        },
        {
          "artifact_id": "pokedb-article-search-config",
          "role": "source_config",
          "relative_path": "tools/data_fetcher/sources/pokedb_champions_article_search.json",
          "required": true,
          "expected_source_id": "pokedb_champions_article_search"
        },
        {
          "artifact_id": "pokedb-article-search-manifest",
          "role": "raw_manifest",
          "relative_path": "data/raw/pokedb_champions_article_search/manifest.json",
          "required": true,
          "expected_source_id": "pokedb_champions_article_search"
        },
        {
          "artifact_id": "pokedb-articles-crawler",
          "role": "fetcher",
          "relative_path": "scripts/fetch_pokedb_articles.py",
          "required": true,
          "expected_source_id": null
        },
        {
          "artifact_id": "pokedb-articles-manifest",
          "role": "raw_manifest",
          "relative_path": "data/raw/pokedb_champions_articles/season_2_rule_0/manifest.json",
          "required": true,
          "expected_source_id": "pokedb_champions_article_search"
        },
        {
          "artifact_id": "pokedb-articles-normalizer",
          "role": "normalizer",
          "relative_path": "scripts/normalize_pokedb_articles.py",
          "required": true,
          "expected_source_id": null
        },
        {
          "artifact_id": "pokedb-garchomp-config",
          "role": "source_config",
          "relative_path": "tools/data_fetcher/sources/pokedb_champions_garchomp_usage_detail.json",
          "required": true,
          "expected_source_id": "pokedb_champions_garchomp_usage_detail"
        },
        {
          "artifact_id": "pokedb-garchomp-manifest",
          "role": "raw_manifest",
          "relative_path": "data/raw/pokedb_champions_garchomp_usage_detail/manifest.json",
          "required": true,
          "expected_source_id": "pokedb_champions_garchomp_usage_detail"
        },
        {
          "artifact_id": "pokedb-usage-config",
          "role": "source_config",
          "relative_path": "tools/data_fetcher/sources/pokedb_champions_pokemon_usage.json",
          "required": true,
          "expected_source_id": "pokedb_champions_pokemon_usage"
        },
        {
          "artifact_id": "pokedb-usage-detail-fetcher",
          "role": "fetcher",
          "relative_path": "scripts/fetch_pokedb_pokemon_usage_details.py",
          "required": true,
          "expected_source_id": null
        },
        {
          "artifact_id": "pokedb-usage-detail-normalizer",
          "role": "normalizer",
          "relative_path": "scripts/normalize_pokedb_pokemon_usage_details.py",
          "required": true,
          "expected_source_id": null
        },
        {
          "artifact_id": "pokedb-usage-detail-parser",
          "role": "parser",
          "relative_path": "tools/data_fetcher/parsers/pokedb_pokemon_usage_detail.py",
          "required": true,
          "expected_source_id": null
        },
        {
          "artifact_id": "pokedb-usage-details-manifest",
          "role": "raw_manifest",